Bellingham Technical College,,HTML Basics,,,WEB 102,Web Development I (HTML Basics) (Computer Science),5.0,,"Teaches HTML and CSS, providing students with the essential skills needed to create basic websites and understand the structure of web pages.",,Web Design 1 CTT151 [HTML Basics],,1.0,"Introduces students to web design, focusing on HTML, CSS, and basic web development techniques to create and maintain simple websites.",,CTE Dual Credit,Active
Bellingham Technical College,,Introduction to Programming,,,SOFT 102,Introduction to Programming,5.0,,"Offers a beginner-friendly introduction to programming, teaching the fundamentals of coding, algorithm development, and problem-solving skills.",,Introduction to Programming 1 // Introduction to Programming 2,,1.0,"Teaches foundational programming concepts and logic using an introductory programming language, focusing on algorithms and basic coding structures.",,CTE Dual Credit,Active
Bellingham Technical College,,Healthcare Foundations - A,,,AHE 120,Safety for Healthcare,5.0,,Introduces workplace safety protocols and infection control practices in healthcare settings.,,Healthcare Foundations A,,1.0,"Introduces students to fundamental healthcare concepts, medical terminology, and basic patient care practices.",,CTE Dual Credit,Active
Bellingham Technical College,,Computer Science Principles (DEV 110),,,DEV 110,"C# Programming, Introduction to",5.0,,"Teaches the basics of C# programming, object-oriented design, and application development.",,Computer Science Principles - AP,,1.0,"Covers foundational computing concepts, programming, algorithms, cybersecurity, and the societal impact of technology.",,CTE Dual Credit,Active
Bellingham Technical College,,Fire Service Physical Fitness I (drill team),,,FIRES 104,Fire Service Physical Fitness I,5.0,,Focuses on fitness training and conditioning tailored for fire service professionals.,,NJROTC Drill Team 1A/1B (fire svs phys fitness),,1.0,"Focuses on military drill training, physical fitness, and discipline, with an emphasis on fire service readiness.",,CTE Dual Credit,Active
Bellingham Technical College,,Graphic Design (DMA 103),,,DMA 103,Digital 2D Design,3.0,,"Explores digital illustration, composition, and design principles using industry-standard software.",,Computer Graphics OR Graphic Arts,,1.0,"Explores digital design, visual communication, and graphic software tools like Adobe Photoshop and Illustrator.",,CTE Dual Credit,Active
Bellingham Technical College,,Introduction to Soils,,,ENV 108,Introduction to Ecology,5.0,,"Examines ecological principles, environmental interactions, and conservation strategies.",,Pac NW Plants/Wildlife 1 [Intro to Soils] // Pac NW Plants/Wildlife 2 [Intro to Soils],,1.0,"Examines regional plant and wildlife ecosystems, emphasizing soil science and conservation practices.",,CTE Dual Credit,Active
Bellingham Technical College,,"Computer Science, AP (CS 210)",,,CS 210,Fundamentals of Computer Science I,5.0,,"Covers algorithms, data structures, and computational problem-solving techniques.",,Computer Science AP (yearlong),,2.0,"A rigorous programming-focused course covering Java, object-oriented design, and problem-solving.",,CTE Dual Credit,Active
Everett Community College,,Horticulture Science AGR 261,,, AGR 261,AGR 261 Plant Science,5.0,,"Studies plant biology, growth, and agricultural applications.",,Horticulture Science - AGR 261,,1.0,"Studies plant biology, propagation, landscaping, and sustainable horticultural practices.",,CTE Dual Credit,Active
Everett Community College,,Introduction to Baking,,,CUL 113,Introduction to Baking,5.0,,"Teaches fundamental baking techniques, ingredient functions, and pastry production.",,Baking and Pastry [Intro to Baking],,1.0,"Covers fundamental baking techniques, ingredient functions, and pastry preparation.",,CTE Dual Credit,Active
Everett Community College,,Digital Photography,,,DED 177,Digital Photography,5.0,,"Introduces camera operation, composition, and photo editing techniques.",,Digital Arts and Filmmaking 1 (540 hrs) [Digital Photography] // Digital Arts and Filmmaking 2 (540 hrs) [Digital Photography],,1.0,"Introduces filmmaking, digital photography, and multimedia storytelling techniques.",,CTE Dual Credit,Active
Everett Community College,,DMA 201/Advanced Video Production,,,DMA 201,Video and Sound Production I,5.0,,"Covers video shooting, editing, and audio production fundamentals.",,Advanced Video Production,,1.0,"Provides hands-on experience in advanced filmmaking, editing, and production techniques.",,CTE Dual Credit,Active
Everett Community College,,Business Communications (hs class: stem),,,RBM 111,Business Communications,5.0,,"Develops professional writing, presentation, and workplace communication skills.",,WBL STEM 350831 // WBL STEM 350832,,1.0,"Work-Based Learning (WBL) opportunities in STEM fields, integrating classroom knowledge with real-world experience.",,CTE Dual Credit,Active
Everett Community College,,Introduction to Nutrition,,,NUTR& 101,Introduction to Nutrition,5.0,,"Explores human nutrition, dietary guidelines, and the role of nutrients in health.",,Nutrition and Wellness - 807101 [Intro to Nutrition],,1.0,"Examines the principles of nutrition, healthy living, and dietary planning.",,CTE Dual Credit,Active
Everett Community College,,CTEC 121/AP Computer Science A,,,CTEC 121,Intro to Programming & Problem Solving,5.0,,"Focuses on programming logic, algorithm development, and software design.",,AP Computer Science A,,2.0,"A college-level course focusing on Java programming, algorithms, and data structures.",,CTE Dual Credit,Active
Everett Community College,,American Sign Language I,,,ASL& 121,American Sign Language I,5.0,,"Introduces ASL vocabulary, grammar, and Deaf culture.",,ASL I FL2011 // ASL I FL2012,,1.0,"Introduces American Sign Language, including basic vocabulary, grammar, and Deaf culture.",,CTE Dual Credit,Active
Everett Community College,,IT Fundamentals,,,NOS 106,IT Fundamentals,5.0,,"Covers foundational IT concepts, hardware, software, and networking basics.",,ITS & Cybersecurity 1 [IT Fundamentals] // ITS & Cybersecurity 2 [IT Fundamentals] // ITS & Cybersecurity 3 [IT Fundamentals],,1.0,"Covers IT basics, networking, security principles, and cyber defense strategies.",,CTE Dual Credit,Active
Everett Community College,,Pharmacy Tech - PHARM 131,,,PHARM 131,Pharmacy Law and Ethics,5.0,,"Examines legal regulations, ethical considerations, and pharmacy practice standards.",,Pharmacy Tech - Pharm 131,,1.0,"Prepares students for pharmacy technician roles, covering pharmacology, prescriptions, and healthcare ethics.",,CTE Dual Credit,Active
Everett Community College,,AGSCI 130 Intro to Animal Science,,,AGSCI 130,AGSCI 130 Intro to Animal Science,5.0,,"Studies animal biology, husbandry, and livestock management.",,AGSCI 130 Intro to Animal Science,,1.0,"Explores animal biology, nutrition, breeding, and livestock management.",,CTE Dual Credit,Active
Everett Community College,,Kinesiology,,,KINS 250,Kinesiology,5.0,,"Explores human movement, biomechanics, and physical activity principles.",,Sports Science - SCI371 [Kinesiology] // Sports Science - SCI372 [Kinesiology],,1.0,"Examines human movement, sports performance, and exercise physiology.",,CTE Dual Credit,Active
Everett Community College,,CUIS 146/Cooking Intro & Cooking Essentials,,,CUIS 146,Culinary Essentials,5.0,,"Covers fundamental cooking techniques, food preparation, and kitchen safety.",,Cooking Essentials // Cooking Intro,,1.0,"Provides hands-on experience with basic cooking techniques, food safety, and meal preparation.",,CTE Dual Credit,Active
Everett Community College,,Video Game Design (GAME 101),,,GAME 101,Intro to Video Game Development,5.0,,"Introduces game design principles, programming, and industry trends.",,Video Game Design,,1.0,"Teaches game development, coding, and design principles using industry-standard tools.",,CTE Dual Credit,Active
Everett Community College,,BUS 160/Financial Literacy,,,BUS 160,Personal Finance,3.0,,"Teaches budgeting, credit management, and financial planning strategies.",,Financial Literacy,,1.0,"Covers personal finance topics such as budgeting, credit, investments, and financial decision-making.",,CTE Dual Credit,Active
Edmonds Community College,,Food Science (CART 115),,,CART 115,Food Service Safety and Sanitation,3.0,,"Covers food safety regulations, sanitation procedures, and ServSafe certification.",,Food Science,,1.0,"Examines the chemistry and biology behind food production, processing, and safety.",,CTE Dual Credit,Active
Edmonds Community College,,Digital Imaging I Adobe Photoshop,,,GTC 132,Digital Imaging I: Adobe Photoshop,5.0,,"Focuses on image editing, retouching, and digital design using Photoshop.",,Photography 1/AP Photography 927411 [Digital Imaging I: Adobe PS] // Photography 1/AP Photography 927413 [Digital Imaging I: Adobe PS],,1.0,"Introduces digital photography, composition, and editing using Adobe Photoshop.",,CTE Dual Credit,Active
Edmonds Community College,,Biotechnology (BIOL 274),,,BIOL 274,Molecular Biology Lab,5.0,,Provides hands-on experience in molecular biology techniques and genetic analysis.,,Biotechnology (407SCI),,2.0,"Covers lab techniques, genetics, and biotech applications in medicine and agriculture.",,CTE Dual Credit,Active
Edmonds Community College,,Cosmetology Year 1 - 1 of 3  Intro to Cosmetology (COS 101),,,COS 101,Introduction to Cosmetology (COS 101),5.0,,"Covers basic cosmetology concepts, hair care, and salon safety practices.",,COSMETOLOGY YEAR ONE - 1 of  3 Intro to Cosmetology  (COS 101),,1.0,"Introduces hairstyling, skincare, and cosmetology industry standards.",,CTE Dual Credit,Active
Edmonds Community College,,"Agriculture, Food, Natural Resources / SAGE 150",,,SAGE 150,Sustainable Agriculture,5.0,,"Examines eco-friendly farming techniques, soil conservation, and sustainable food systems.",,"Agriculture, Food, Natural Resources",,1.0,"Explores agricultural science, food production, and environmental sustainability.",,CTE Dual Credit,Active
Edmonds Community College,,Accounting I,,,ACTG 110,Accounting I,5.0,,"Introduces basic accounting principles, financial statements, and bookkeeping.",,Retail Operations 1 BUS220 [Accounting I] // Retail Operations 2 BUS221 [Accounting I],,1.0,"Teaches retail management, customer service, and financial record-keeping.",,CTE Dual Credit,Active
Edmonds Community College,,"American Sign Language, 2nd Year (ASL& 122)",,,ASL& 122,American Sign Language 2,5.0,,"Expands on ASL skills, conversational fluency, and cultural awareness.",,"American Sign Language, 2nd Year",,1.0,"Builds on ASL basics with advanced grammar, vocabulary, and conversational skills.",,CTE Dual Credit,Active
Skagit Valley College,,Horticulture - Env Sci (HORT 299),,,HORT 299,Horticulture - Independent Studies (4 credits),4.0,,Allows students to conduct independent research in plant science and horticulture.,,Environmental Science,,1.0,"Studies ecosystems, pollution, conservation, and sustainability efforts.",,CTE Dual Credit,Active
Skagit Valley College,,Intro to Education (EDUC& 202),,,EDUC& 202,Introduction to Education,5.0,,"Explores teaching methods, educational theories, and career pathways in education.",,Careers In Education (EDUC& 202),,1.0,Prepares students for careers in teaching through educational theory and classroom observation.,,CTE Dual Credit,Active
Skagit Valley College,,Introduction to Investigation Forensics,,,CJ& 240,Introduction to Investigation Forensics (Intro to Forensic Science),3.0,,"Introduces forensic science, crime scene investigation, and evidence analysis.",,Law Enforcement 8870 (540 hrs) [Intro to Investigation Forensics] // Law Enforcement 8871 (540 hrs) [Intro to Investigation Forensics],,1.0,"Covers policing, criminal investigation, and forensic science.",,CTE Dual Credit,Active
Skagit Valley College,,Criminal Law (CJ102),,,CJ 102,Introduction to Criminal Law,1.0,,"Covers the fundamentals of criminal law, legal procedures, and court systems.",,Criminal Justice PSC1V1 [Criminal Law] // Criminal Justice PSC1V2 [Criminal Law] // Criminal Justice PSC1V3 [Criminal Law],,1.0,"Examines criminal law, the justice system, and legal procedures.",,CTE Dual Credit,Active
Skagit Valley College,,Private Pilot Basic Ground School,,,AVP 105,Private Pilot Basic Ground School,5.0,,Prepares students for FAA ground school with flight theory and navigation basics.,,Drone Pilot (UAS) [Private Pilot Basic Ground School],,1.0,"Introduces drone operation, FAA regulations, and flight safety.",,CTE Dual Credit,Active
Skagit Valley College,,Biotechnology (BIOL 274),,,BIOL 274,Molecular Biology Lab,5.0,,"Provides laboratory techniques for studying DNA, RNA, and proteins.",,Biotechnology (SCB315A/B),,1.0,"Focuses on laboratory techniques, genetic engineering, and biotech research applications.",,CTE Dual Credit,Active
Skagit Valley College,,"Human Body Systems PLTW (MEDA 130,131 & 162)",,,MEDA 130,Anatomy/Physiology & Pathophysiology I (MEDA 130),3.0,,"Covers human body systems, disease processes, and medical terminology.",,Human Body Systems,,1.0,"Examines human anatomy, physiology, and the interactions of body systems.",,CTE Dual Credit,Active
Skagit Valley College,,Computer Literacy - CIS 100 (WCC),,,CIS 100,Computer Literacy (CIS 100),5.0,,"Introduces basic computer skills, software applications, and digital communication.",,Technical Literacy - Computer Literacy,,1.0,"Develops proficiency in computer applications, digital communication, and basic coding.",,CTE Dual Credit,Active
Skagit Valley College,,Sanitation & Safety - CUL 110 (BTC),,,CUL 110,Sanitation - ServSafe (CUL 110),5.0,,Prepares students for ServSafe certification in food safety and sanitation.,,Culinary 1,,1.0,"Introduces cooking techniques, food preparation, and culinary industry standards.",,CTE Dual Credit,Active
Skagit Valley College,,BUS 115/Business & Entrepreneurship,,,BUS 115,Small Business Managment,5.0,,"Covers entrepreneurship, business planning, and operational strategies.",,Business & Entrepreneurship,,2.0,"Covers business principles, marketing, and startup development.",,CTE Dual Credit,Active
Skagit Valley College,,Introduction to Engineering Design / ENG T 100 Intro to Engineering Graphics with 2D AutoCAD,,,ENG T 100,Intro to Engineering Graphics with 2D AutoCAD,3.0,,Teaches technical drawing and CAD software for engineering design.,,Introduction to Engineering Design / ENG T 100 Intro to Engineering Graphics with 2D AutoCAD,,1.0,"Teaches engineering design principles, technical drawing, and AutoCAD software.",,CTE Dual Credit,Active
Skagit Valley College,,Basic Carpentry Skills [CONST 106],,,CONST 106,Basic Carpentry Skills,5.0,,"Introduces fundamental carpentry techniques, tool usage, and construction safety.",,Construction Trades 2A ICT401 [Basic Carpentry Skills] // Construction Trades 2B ICT402 [Basic Carpentry Skills],,1.0,"Covers carpentry techniques, tool use, and construction safety.",,CTE Dual Credit,Active
Skagit Valley College,,Graphic Design (MIT 226),,,MIT 226,Adobe Photoshop (MIT 226),3.0,,Explores advanced Photoshop tools for digital imaging and design.,,Graphic Design (MIT 226),,1.0,"Teaches principles of design, branding, and digital media creation.",,CTE Dual Credit,Active
Skagit Valley College,,Health (IFAD 162),,,IFAD 162,First Aid / CPR for Health Care Providers,5.0,,Provides CPR and emergency response training for healthcare settings.,,Health,,1.0,"Explores personal health, wellness, and disease prevention strategies.",,CTE Dual Credit,Active
Skagit Valley College,,Floral Design - AGHRT 211,,,AGHRT 211,Floral Design Techniques,5.0,,"Teaches floral arrangement, design principles, and event planning applications.",,Floral Design - AGHRT 211,,1.0,"Covers flower arranging, horticulture, and floral business management.",,CTE Dual Credit,Active
Skagit Valley College,,Careers in Education Practicum (grades K-12) [EDUC& 191],,,EDUC& 191,Field Experience I - Cooperative Work Experience (Careers in Ed Practicum K-12),1.0,,Provides hands-on teaching experience in K-12 classrooms.,,Teaching Academy 1 - CIE311 [Careers in Educ Pract K-12] // Teaching Academy 2 - CIE312 [Careers in Educ Pract K-12],,1.0,Provides hands-on experience in education and classroom instruction.,,CTE Dual Credit,Active
Skagit Valley College,,Safety & Operating Certificate [CONST 102],,,CONST 102,Safety & Operating Certificate,5.0,,"Covers workplace safety, equipment operation, and industry standards.",,Skilled Trades Pre-Apprenticeship [Safety & Operating Certificate],,1.0,Prepares students for entry into skilled trade apprenticeships.,,CTE Dual Credit,Active
Skagit Valley College,,Animal Science (Chiawana),,,AG 102,Intro to Animal Science and Lab,3.0,,"Studies animal anatomy, nutrition, and agricultural applications.",,Animal Science 1 // Animal Science 2,,1.0,"Explores livestock management, animal health, and breeding practices.",,CTE Dual Credit,Active
Skagit Valley College,,CDL Prep - TRK 110,,,TRK 110,Truck Driver Training,1.0,,Prepares students for obtaining a Commercial Driver’s License (CDL).,,CDL Prep-TRK 110,,2.0,"Prepares students for the Commercial Driver’s License (CDL) exam, covering driving regulations and vehicle operation.",,CTE Dual Credit,Active
Skagit Valley College,,Video Production (FILM 285),,,FILM 285,Film Production (FILM 285),5.0,,"Covers film production techniques, directing, and post-production editing.",,Video Production,,1.0,"Teaches filmmaking, editing, and production techniques.",,CTE Dual Credit,Active
Skagit Valley College,,Introduction to Medical Careers,,,BTECM 149,Introduction to Medical Careers,5.0,,Provides an overview of healthcare professions and industry expectations.,,Intro to Medical Careers - 466111 // Intro to Medical Careers - 466112,,1.0,"Introduces healthcare professions, medical ethics, and basic patient care.",,CTE Dual Credit,Active
Skagit Valley College,,Medical Terminology/MED102,,,MED102,Medical Terminology for Medical Assistants MED,5.0,,Introduces terminology used in medical settings for effective communication.,,Anatomy and Physiology,,1.0,Studies the structure and function of the human body with a focus on medical applications.,,CTE Dual Credit,Active
